<?xml version="1.0" encoding="UTF-8"?>
<system-config xmlns="http://WfDSystemConfig.config.wfdefinition.loushang.org" xmlns:xsi="http://www.w3.org/2001/XMLSchema-instance" xsi:schemaLocation="http://WfDSystemConfig.config.wfdefinition.loushang.org WfDSystemConfig.xsd ">
	<!--系统自动任务,一般分配到各个环节执行-->
	<auto-task>
	<!--属性:id 任务id,name 任务名称,task-class 任务执行类,description 任务说明-->
		<!--<task id="testTaskApprove" name="审批通过" task-class="net.mast.workflow.test.TaskApprove" flow-type="" description=""/>
		<task id="testTaskReject"  name="审批驳回" task-class="net.mast.workflow.test.TaskReject" flow-type="" description=""/>
	  	 <task id="examplemeeting"  name="修改会议状态" task-class="bpmexample.meeting.ChangeState" flow-type="" description=""/> -->
		
		<!-- 主流程使用:在主流程中启动子流程,异步 -->
		<task id="StartSubProcWait" name="启动子流程异步" 
		task-class="net.mast.workflow.subProcess.StartSubProcAyn" flow-type="" description="" Execution="ASYNCHR"/>
		
		<!-- 主流程使用:在主流程中启动子流程,异步 
		<task id="StartSubProcAynCommon" name="启动子流程异步通用" 
		task-class="net.mast.workflow.subProcess.StartSubProcAynCommon" flow-type="" description="" Execution="ASYNCHR"/>-->
		
		<!-- 主流程使用:流程定义在隐藏域中,异步 
		<task id="StartSubProcAynFromHidden" name="用隐藏域数据启动子流程异步" 
		task-class="net.mast.workflow.subProcess.StartSubProcAynFromHidden" flow-type="" description="" Execution="ASYNCHR"/>-->
		
		<!-- 主流程使用:流程定义和创建者在隐藏域中,异步 
		<task id="StartSubProcAynFromHidden_Proc_UserId" name="用隐藏流程定义和创建者启动子流程异步" 
		task-class="net.mast.workflow.subProcess.StartSubProcAynFromHidden_Proc_UserId" flow-type="" description="" Execution="ASYNCHR"/>-->
		
		<!-- 主流程使用:流程定义在相关参数中,异步 
		<task id="StartSubProcAynFromParas" name="用相关数据启动子流程异步" 
		task-class="net.mast.workflow.subProcess.StartSubProcAynFromParas" flow-type="" description="" Execution="ASYNCHR"/>-->
		
		<!-- 主流程使用:在主流程中启动子流程,同步 -->
		<task id="StartSubProcNoWait" name="启动子流程同步" 
		task-class="net.mast.workflow.subProcess.StartSubProcSyn" flow-type="" description=""/>
		
		<!-- 主流程使用:在主流程中启动子流程,同步 
		<task id="StartSubProcSynCommon" name="启动子流程同步通用"
		task-class="net.mast.workflow.subProcess.StartSubProcSynCommon" flow-type="" description=""/>-->
		
		<!-- 主流程使用:通过获取流程定义时的相关参数中的流程定义,创建子流程,创建者仍然从表单上面取,遵循表单的字段定义,同步 
		<task id="StartSubProcAynFromParas" name="用相关数据启动子流程同步"
		task-class="net.mast.workflow.subProcess.StartSubProcSynFromParas" flow-type="" description=""/>-->
		
		<!-- 主流程使用:通过表单的隐藏域获取子流程定义ID,同步 
		<task id="StartSubProcSynFormHidden" name="用隐藏域数据启动子流程同步"
		task-class="net.mast.workflow.subProcess.StartSubProcSynFromHidden" flow-type="" description=""/>-->
		
		<!-- 主流程使用:通过表单的隐藏域获取子流程定义ID和创建者ID,同步 
		<task id="StartSubProcSynFromHidden_Proc_UserId" name="用隐藏流程定义和创建者启动子流程同步"
		task-class="net.mast.workflow.subProcess.StartSubProcSynFromHidden_Proc_UserId" flow-type="" description=""/>-->
		
		<!-- 子流程使用:启动并返回数据给主流程,配合启动子流程异步使用 -->
		<task id="Start_ReturnDataToMainProc" name="启动并返回数据给主流程" 
		task-class="net.mast.workflow.subProcess.Start_ReturnDataToMainProc" flow-type="" description=""/>
		
		<!-- 子流程使用:返回子流程数据给主流程,根据保留域交换数据,配合同步启动子流程使用 
		<task id="ReturnDataToMainProc" name="返回数据给主流程" 
		task-class="net.mast.workflow.subProcess.ReturnDataToMainProc" flow-type="" description=""/>-->
		
		<!-- 子流程使用:根据表单上的域名来交换数据 -->
		<task id="ReturnDataByFieldName" name="根据域名交换数据"
		task-class="net.mast.workflow.subProcess.ReturnDataByFieldName" flow-type="" description=""/>

		<task id="forTest" name="环节自动任务测试" task-class="net.mast.workflow.test.TestTask" flow-type="" description=""/>

		 		
 	</auto-task>	
	<!--系统内置的操作条件,一般作为环节操作条件-->
	<system-condition>
	<!--属性:id 条件id ,name 条件名称,expression 条件表达式-->
		<condition id="isNewDOc" name="新文档" >
		<![CDATA[ (field_DATAID==null || "".equals(field_DATAID)) ]]>
		</condition>
		<condition id="isNewDOc" name="非新文档" >
		<![CDATA[ !(field_DATAID==null || "".equals(field_DATAID)) ]]>
		</condition>		
		<condition id="curParty" name="当前处理人">
		 <![CDATA[ (activityUser.contains(curUser)) ]]>
		</condition>
		<condition id="curParty" name="非当前处理人">
		 <![CDATA[ !(activityUser.contains(curUser)) ]]>
		</condition>
		<condition id="huiqian" name="会签" >
		<![CDATA[ (isMulti.booleanValue()) ]]>
		</condition>
		<condition id="lastHuiqian" name="最后会签人">
			<![CDATA[ (taskCount.intValue()==1) ]]>
		</condition>			
		<condition id="notlastHuiqian" name="非最后会签人">
			<![CDATA[ (taskCount.intValue()>1) ]]>
		</condition>				
		<condition id="huiqian" name="非会签" >
		<![CDATA[ !(isMulti.booleanValue()) ]]>
		</condition>
		<condition id="response" name="监控者" >
		<![CDATA[ (activityResponsibleUser.contains(curUser)) ]]>
		</condition>
		<condition id="response" name="非监控者" >
		<![CDATA[ !(activityResponsibleUser.contains(curUser)) ]]>
		</condition>	
		<condition id="history" name="历史参与者" >
		<![CDATA[ (processHistoryUser.contains(curUser)) ]]>
		</condition>
		<condition id="history" name="非历史参与者" >
		<![CDATA[ !(processHistoryUser.contains(curUser)) ]]>
		</condition>
		<condition id="sendUser" name="发送人" >
		<![CDATA[ (previousUserIds.contains(curUser)) ]]>
		</condition>
		<condition id="notSendUser" name="非发送人" >
		<![CDATA[ !(previousUserIds.contains(curUser)) ]]>
		</condition>
<!--	<condition id="read" name="已读" >
		<![CDATA[ ("1".equals(docReadFlag)) ]]>
		</condition>
		<condition id="notRead" name="未读" >
		<![CDATA[ (docReadFlag==null || "".equals(field_DATAID) || "0".equals(field_DATAID)) ]]>
		</condition>
-->
		<condition id="open.running" name="运行状态">
			<![CDATA[ ("open.running".equals(proCurrentState)) ]]>
		</condition>
		<condition id="open.not_running" name="未运行状态">
			<![CDATA[ ("open.not_running".equals(proCurrentState)) ]]>
		</condition>
<!--
		<condition id="open.not_running.not_started" name="未开始状态">
			<![CDATA[ ("open.not_running.not_started".equals(proCurrentState)) ]]>
		</condition>
-->
		<condition id="open.not_running.suspended" name="挂起">
			<![CDATA[ ("open.not_running.suspended".equals(proCurrentState)) ]]>
		</condition>
		<condition id="closed.completed" name="结束">
			<![CDATA[ ("closed.completed".equals(proCurrentState)) ]]>
		</condition>
<!--
		<condition id="closed.terminated" name="强制结束">
			<![CDATA[ ("closed.terminated".equals(proCurrentState)) ]]>
		</condition>
		<condition id="closed.aborted" name="取消">
			<![CDATA[ ("closed.aborted".equals(proCurrentState)) ]]>
		</condition>		
-->
		<condition id="read_only" name="只读">
			<![CDATA[(!activityUser.contains(curUser) && !"".equals(DATAID_field)) || readOnlyFieldList.contains("${name}") || isLocked.booleanValue()]]>
		</condition>					
	</system-condition>
	<!--流程、环节时间限制-->
	<limit>
	<!--属性:id 限制id,name 限制名称,agent-class 代理执行类,flow-type 流程类型，description 限制说明-->
		<agent id="limit" name="限时提醒" agent-class="net.mast.workflow.wfclient.taskinfo.limit.CommonLimitAgent" flow-type="" description="" />
		<agent id="warn" name="警告提醒" agent-class="net.mast.workflow.wfclient.taskinfo.limit.CommonWarnLimitAgent" flow-type="" description="" />
		<agent id="submit" name="自动提交" agent-class="net.mast.workflow.wfclient.taskinfo.limit.CommonSubmitLimitAgent" flow-type="" description="该选项适用于不需要选择的任务发送方式" />		
	</limit>
	<!--流程附件(例如：word正文)权限配置项-->
	<adjunct-right>
		<tab id="docRright" title="编辑权限" flow-type="" align="horizontal">
			<option id="edit" title="可编辑" key="documentRight" type="radio" align="horizontal" >
				<enum-group id="emendRight" title="修订权限" align="Vertical">
					<enum-value id="true" title="显示修订" key="emendRight" type="radio"/>
					<enum-value id="hidden" title="隐藏修订" key="emendRight" type="radio"/>
					<enum-value id="false" title="保持不变" key="emendRight" type="radio"/>
				</enum-group>	
			</option>
			<option id="read" title="可浏览" key="documentRight" type="radio" align="horizontal" isdefault="true">
				<enum-group id="emendRight" title="修订权限" align="Vertical">
					<enum-value id="true" title="显示修订" key="emendRight" type="radio" isdefault="true"/>
					<enum-value id="hidden" title="隐藏修订" key="emendRight" type="radio"/>
					<enum-value id="false" title="保持不变" key="emendRight" type="radio"/>
				</enum-group>
			</option>	
			<option id="emend" title="可修订" key="documentRight" type="radio" align="horizontal">
				<enum-group id="emendRight" title="修订权限" align="Vertical">
					<enum-value id="true" title="用户可以接受修订" key="emendRight" type="radio"/>
					<enum-value id="false" title="用户不能接受修订" key="emendRight" type="radio"/>
				</enum-group>			
			</option>										
		</tab>
		<tab id="accessRright" title="存取权限" flow-type=""   align="horizontal">
			<option id="docLocalOpen" title="是否有本地文件导入的权限" type="label" align="horizontal">
				<enum-value id="true" title="有" key="docLocalOpen" type="radio"/>
				<enum-value id="false" title="没有" key="docLocalOpen" type="radio"/>
			</option>
			<option id="docLocalSave" title="是否能另存为本地文件" type="label" align="horizontal">
				<enum-value id="true" title="能" key="docLocalSave" type="radio"/>
				<enum-value id="false" title="不能" key="docLocalSave" type="radio"/>
			</option>			
		</tab>	
		<tab id="sealRright" title="盖章权限" flow-type=""  align="horizontal">
			<option id="docSeal" title="是否可以盖章" type="label" align="horizontal">
				<enum-value id="true" title="是" key="docSeal" type="radio"/>
				<enum-value id="false" title="否" key="docSeal" type="radio"/>
			</option>
			<option id="docProtectSeal" title="是否保护印章" type="label" align="horizontal">
				<enum-value id="true" title="保护" key="docProtectSeal" type="radio"/>
				<enum-value id="false" title="不保护" key="docProtectSeal" type="radio"/>
			</option>			
		</tab>	
		<tab id="signRight" title="批注权限" flow-type=""  align="horizontal">
			<option id="docSign" title="是否全文批注" type="label" align="horizontal">
				<enum-value id="true" title="是" key="docSign" type="radio"/>
				<enum-value id="false" title="否" key="docSign" type="radio"/>
			</option>
			<option id="docSignClear" title="全文批注是否清稿" type="label" align="horizontal"> 
				<enum-value id="true" title="是" key="docSignClear" type="radio"/>